{"kind":"snapshot","manifest_path":"snapshots/2026-10-11/0f7db7a3-f7d6-57bc-b82f-0f780bbd5ccf/manifest.json.gz","manifest_sha256":"097a01358d29c40466fe21c70c4adc72a0179e999cca6006877cc86dbeeb07e8","persisted_at":"2026-10-10T10:33:26Z","run_id":"0f7db7a3-f7d6-57bc-b82f-0f780bbd5ccf","schema_version":"1.1","status":"succeeded","storage_commit":"6366e094bde5a3c2433d481e37febf3c132c9206","valid_end":"2026-10-17T16:00:00Z","valid_start":"2026-10-10T16:00:00Z"}
