{"kind":"snapshot","manifest_path":"snapshots/2026-10-21/9844a9b7-6396-5347-b155-8467cb321e69/manifest.json.gz","manifest_sha256":"e5061669038f6db06050d47aaf57b7fb51d527c6b168f3a4357ed767e0a1ce90","persisted_at":"2026-10-20T12:16:23Z","run_id":"9844a9b7-6396-5347-b155-8467cb321e69","schema_version":"1.1","status":"succeeded","storage_commit":"1832e8db53b836de22cd6eb5a8d32e8bfb98814f","valid_end":"2026-10-27T16:00:00Z","valid_start":"2026-10-20T16:00:00Z"}
