{"kind":"snapshot","manifest_path":"snapshots/2026-10-31/8732e831-7070-5697-b265-0161ee4f3be6/manifest.json.gz","manifest_sha256":"ea1d64657b8a019dd725b7637e7748614111a6a1bcf617b5adf24871f54625e3","persisted_at":"2026-10-30T03:27:53Z","run_id":"8732e831-7070-5697-b265-0161ee4f3be6","schema_version":"1.1","status":"succeeded","storage_commit":"f742c29b9a5cc64af1c3b2200bda60b6b1f770c5","valid_end":"2026-11-06T16:00:00Z","valid_start":"2026-10-30T16:00:00Z"}
