{"kind":"snapshot","manifest_path":"snapshots/2026-10-08/f9ee4ff9-b838-574b-ae92-ee4a7c4f9ce0/manifest.json.gz","manifest_sha256":"e2b18a50bcb1eb221a794049e5d04c0b95e549ac901683278c2b3a3e4683c368","persisted_at":"2026-10-07T15:37:46Z","run_id":"f9ee4ff9-b838-574b-ae92-ee4a7c4f9ce0","schema_version":"1.1","status":"succeeded","storage_commit":"f515c6dd863251c8bba81ba926560d159cf8decd","valid_end":"2026-10-14T16:00:00Z","valid_start":"2026-10-07T16:00:00Z"}
