{"kind":"snapshot","manifest_path":"snapshots/2026-10-16/84111179-52cc-5dad-985a-59a6a5f36c52/manifest.json.gz","manifest_sha256":"a3222c975f52a5c66d8106c3e9fbd0f4adb85a4bcdc337e6ee2b8b22180e20b1","persisted_at":"2026-10-15T16:28:09Z","run_id":"84111179-52cc-5dad-985a-59a6a5f36c52","schema_version":"1.1","status":"succeeded","storage_commit":"ba24d4a494fe842125b1b1c020824792b7f20b9e","valid_end":"2026-10-22T16:00:00Z","valid_start":"2026-10-15T16:00:00Z"}
