{"kind":"snapshot","manifest_path":"snapshots/2026-10-21/fdeda420-dd14-5a90-9fef-202001a70607/manifest.json.gz","manifest_sha256":"d20dd6966637e0005a7800e2b3e6bf438096520c143f2d2a0a5cef92b1f0727b","persisted_at":"2026-10-20T18:20:57Z","run_id":"fdeda420-dd14-5a90-9fef-202001a70607","schema_version":"1.1","status":"succeeded","storage_commit":"a759f3a619195fba32236b734037448bc27abfaf","valid_end":"2026-10-27T16:00:00Z","valid_start":"2026-10-20T16:00:00Z"}
