{"kind":"snapshot","manifest_path":"snapshots/2026-10-17/84d4b1f4-513a-5b43-b7d5-c3a263052c94/manifest.json.gz","manifest_sha256":"05a5e959dca5f93d8044535edd8f6becd809a5db6d3c9babdba5f5989f56faa3","persisted_at":"2026-10-16T05:01:03Z","run_id":"84d4b1f4-513a-5b43-b7d5-c3a263052c94","schema_version":"1.1","status":"succeeded","storage_commit":"b83c2cc93ccd787e742785e8baf025befc4804df","valid_end":"2026-10-23T16:00:00Z","valid_start":"2026-10-16T16:00:00Z"}
