{"kind":"snapshot","manifest_path":"snapshots/2026-10-23/38e4eeb5-ab9e-5cc2-b919-594a1206b15b/manifest.json.gz","manifest_sha256":"52749de0a2805e1ccc21dea74d99d9cbdbc6f2cf60ef290fc52648ac90f9375b","persisted_at":"2026-10-21T21:28:06Z","run_id":"38e4eeb5-ab9e-5cc2-b919-594a1206b15b","schema_version":"1.1","status":"succeeded","storage_commit":"d1fcb2408308256d408925e1dad5d289d8b82418","valid_end":"2026-10-29T16:00:00Z","valid_start":"2026-10-22T16:00:00Z"}
