{"kind":"snapshot","manifest_path":"snapshots/2026-10-17/04e3bc48-cbc9-52d8-9d8a-00f723eaa972/manifest.json.gz","manifest_sha256":"bcbe9c5ef5d1e69afda2c942746e3f52b296ab01e329e081bdca42a2aad67196","persisted_at":"2026-10-16T07:01:04Z","run_id":"04e3bc48-cbc9-52d8-9d8a-00f723eaa972","schema_version":"1.1","status":"succeeded","storage_commit":"4680fe9e148bb2344cde009473b7c0c3a96e6aec","valid_end":"2026-10-23T16:00:00Z","valid_start":"2026-10-16T16:00:00Z"}
