{"kind":"snapshot","manifest_path":"snapshots/2026-10-28/cc03f7fd-07b8-593b-898c-2fd7973c5f7c/manifest.json.gz","manifest_sha256":"1222edfe5b0c1e2823b42c1c8ed1dbe1f9c126d2de3e1e67af7147063eb0b3e9","persisted_at":"2026-10-27T02:38:41Z","run_id":"cc03f7fd-07b8-593b-898c-2fd7973c5f7c","schema_version":"1.1","status":"succeeded","storage_commit":"e112e4032c4746f3df7c219d446dc316b32ff3bd","valid_end":"2026-11-03T16:00:00Z","valid_start":"2026-10-27T16:00:00Z"}
