{"kind":"snapshot","manifest_path":"snapshots/2026-10-18/9f79d483-5609-5741-aa6f-77d27603f32d/manifest.json.gz","manifest_sha256":"85d39fc5609b66e84c97109b3dc4cc59a3e220da0fe9eb26456ddd599c5475f3","persisted_at":"2026-10-17T03:51:19Z","run_id":"9f79d483-5609-5741-aa6f-77d27603f32d","schema_version":"1.1","status":"succeeded","storage_commit":"cfce16e7f93dafe7c7cd19be7ee51c3d35d2c0ec","valid_end":"2026-10-24T16:00:00Z","valid_start":"2026-10-17T16:00:00Z"}
