{"kind":"snapshot","manifest_path":"snapshots/2026-10-11/c3291347-3338-5872-b74c-7dadc2a18788/manifest.json.gz","manifest_sha256":"81a0f1118689b05836898ab4477ec0ec281d4c67a5a199d8f6fd720923f6bf17","persisted_at":"2026-10-10T07:24:29Z","run_id":"c3291347-3338-5872-b74c-7dadc2a18788","schema_version":"1.1","status":"succeeded","storage_commit":"11816101f688b7e8a7417d33850a0a5c4aaa3476","valid_end":"2026-10-17T16:00:00Z","valid_start":"2026-10-10T16:00:00Z"}
