{"kind":"snapshot","manifest_path":"snapshots/2026-10-09/62f935be-6deb-5286-a0af-c6daf2f1081e/manifest.json.gz","manifest_sha256":"2bba12a8142364731bf8dd99582461513220060998a2cc5d1835b467f63a655d","persisted_at":"2026-10-07T18:24:32Z","run_id":"62f935be-6deb-5286-a0af-c6daf2f1081e","schema_version":"1.1","status":"succeeded","storage_commit":"e78e1da7585b958ce25ea5c7e27f2d40c675021f","valid_end":"2026-10-15T16:00:00Z","valid_start":"2026-10-08T16:00:00Z"}
