{"kind":"snapshot","manifest_path":"snapshots/2026-10-21/3e1e1456-b849-5c31-b669-ac8228551d7e/manifest.json.gz","manifest_sha256":"a554787002b3e0d877486512fbdfa4bb83c677fa67d2fe9373dc5aa14dc9b61e","persisted_at":"2026-10-20T04:27:52Z","run_id":"3e1e1456-b849-5c31-b669-ac8228551d7e","schema_version":"1.1","status":"succeeded","storage_commit":"800ecb6e76dded2f374c9c2eda7faedff7a06560","valid_end":"2026-10-27T16:00:00Z","valid_start":"2026-10-20T16:00:00Z"}
