{"kind":"snapshot","manifest_path":"snapshots/2026-10-13/abf88c77-338f-528b-8f7e-94c5b84e2fd3/manifest.json.gz","manifest_sha256":"b597780ed58ede7cdd5b323900d8528e198ea7f97a6ebfc99e1762717bbdcb85","persisted_at":"2026-10-12T03:49:37Z","run_id":"abf88c77-338f-528b-8f7e-94c5b84e2fd3","schema_version":"1.1","status":"succeeded","storage_commit":"4e64897ce1cdc88e19df7d0044bd460fc21d7dad","valid_end":"2026-10-19T16:00:00Z","valid_start":"2026-10-12T16:00:00Z"}
