{"kind":"snapshot","manifest_path":"snapshots/2026-10-17/2edf38ac-cc5a-5fd3-b720-36a89afac100/manifest.json.gz","manifest_sha256":"b64eeb54aee2c7a6230635b995b423bf3b5ced075045d5d0cd5c6b1e042324bb","persisted_at":"2026-10-16T02:49:27Z","run_id":"2edf38ac-cc5a-5fd3-b720-36a89afac100","schema_version":"1.1","status":"succeeded","storage_commit":"c75ffd0c7f08b929df93609b0c23aac60fb4972a","valid_end":"2026-10-23T16:00:00Z","valid_start":"2026-10-16T16:00:00Z"}
