{"kind":"snapshot","manifest_path":"snapshots/2026-10-11/b2ab1add-f8df-5629-a6e6-c767a8b36611/manifest.json.gz","manifest_sha256":"0543c0ff46842f7982be2c9a6316cb34e8eab941fd29291ddb941ce4eb2737e9","persisted_at":"2026-10-10T04:07:28Z","run_id":"b2ab1add-f8df-5629-a6e6-c767a8b36611","schema_version":"1.1","status":"succeeded","storage_commit":"dea305f1554b15d2de933e9f5f9c1a0609575f50","valid_end":"2026-10-17T16:00:00Z","valid_start":"2026-10-10T16:00:00Z"}
