{"kind":"snapshot","manifest_path":"snapshots/2026-10-16/2d60b9ab-dfc9-5600-8280-3d952f6234a1/manifest.json.gz","manifest_sha256":"6d5df5de0f5c9781ca442a75564340fa6b40fe00f7cf430899e2be71f758002e","persisted_at":"2026-10-15T04:21:17Z","run_id":"2d60b9ab-dfc9-5600-8280-3d952f6234a1","schema_version":"1.1","status":"succeeded","storage_commit":"1d25f0bf30a671d2642db4b2b7f89d947fdd72b8","valid_end":"2026-10-22T16:00:00Z","valid_start":"2026-10-15T16:00:00Z"}
