{"kind":"snapshot","manifest_path":"snapshots/2026-10-14/c6e4b0de-89f6-5602-a11e-b7de62d0baa1/manifest.json.gz","manifest_sha256":"62b1babce43383edb06e4787e0dacb39941305bf2454d98d1dc09d3d4815e212","persisted_at":"2026-10-13T06:23:12Z","run_id":"c6e4b0de-89f6-5602-a11e-b7de62d0baa1","schema_version":"1.1","status":"succeeded","storage_commit":"0b86e0ec991b922f88a79cc8c5fc1184f7a50e56","valid_end":"2026-10-20T16:00:00Z","valid_start":"2026-10-13T16:00:00Z"}
