{"kind":"snapshot","manifest_path":"snapshots/2026-10-20/3481fac1-fd3d-551b-af18-2ee8540c8847/manifest.json.gz","manifest_sha256":"82a190d40a0d5994f2051fa42aa4a89706a880ae1da47175692d6f31e01a5e2d","persisted_at":"2026-10-19T11:54:20Z","run_id":"3481fac1-fd3d-551b-af18-2ee8540c8847","schema_version":"1.1","status":"succeeded","storage_commit":"5d1a7abbf689127d4f85132ed54fcd4e9c4e8f8e","valid_end":"2026-10-26T16:00:00Z","valid_start":"2026-10-19T16:00:00Z"}
