{"kind":"snapshot","manifest_path":"snapshots/2026-10-13/87fea391-6da4-5a94-9ea4-092aefbf07ca/manifest.json.gz","manifest_sha256":"4817914cc320ebc19682a3f20ca2aa91d07dcb9edb7591d6c309c6b77698e238","persisted_at":"2026-10-12T03:05:38Z","run_id":"87fea391-6da4-5a94-9ea4-092aefbf07ca","schema_version":"1.1","status":"succeeded","storage_commit":"79190050536652fbaf841363ff510782daf236ad","valid_end":"2026-10-19T16:00:00Z","valid_start":"2026-10-12T16:00:00Z"}
