{"kind":"snapshot","manifest_path":"snapshots/2026-10-10/11df8e11-d5ec-5d27-9f98-e58d0b2b0c71/manifest.json.gz","manifest_sha256":"c6c6cc72f1e3af3fe372a54088107da0357d9385de42b54cea23a263e08aedc2","persisted_at":"2026-10-09T12:56:55Z","run_id":"11df8e11-d5ec-5d27-9f98-e58d0b2b0c71","schema_version":"1.1","status":"succeeded","storage_commit":"1ce639c5c7c598bc79c2112fa217bef026f56495","valid_end":"2026-10-16T16:00:00Z","valid_start":"2026-10-09T16:00:00Z"}
