{"kind":"snapshot","manifest_path":"snapshots/2026-10-24/42db99da-fcfd-52b0-b6e7-4bdcd9dbf7bf/manifest.json.gz","manifest_sha256":"c71a999c62bb91ff9a67668df29d543e55e2280cee9fe026f666c384fc7be326","persisted_at":"2026-10-23T11:38:04Z","run_id":"42db99da-fcfd-52b0-b6e7-4bdcd9dbf7bf","schema_version":"1.1","status":"succeeded","storage_commit":"03857eb4986d2731bfb7fedeb3c1d0b8c7dcf335","valid_end":"2026-10-30T16:00:00Z","valid_start":"2026-10-23T16:00:00Z"}
